{
  "$schema": "https://json-schema.org/draft/2020-12/schema",
  "$id": "https://github.com/auction-promax/api/security/schemas/cyclonedx-schemas.schema.json",
  "title": "CycloneDX 1.6 Schema Trust Manifest",
  "description": "Fail-closed Cycle 2 contract for the reviewed CycloneDX 1.6 JSON Schema trust set. Schema files are vendored only after each official tag asset matches this committed SHA-256 value.",
  "type": "object",
  "additionalProperties": false,
  "required": ["schemaVersion", "specVersion", "officialSchemaBaseUrl", "assets"],
  "properties": {
    "schemaVersion": { "const": 1 },
    "specVersion": { "const": "1.6" },
    "officialSchemaBaseUrl": { "const": "https://raw.githubusercontent.com/CycloneDX/specification/1.6/schema" },
    "assets": {
      "type": "array",
      "minItems": 3,
      "maxItems": 3,
      "prefixItems": [
        { "$ref": "#/$defs/bomSchema" },
        { "$ref": "#/$defs/spdxSchema" },
        { "$ref": "#/$defs/jsfSchema" }
      ],
      "items": false
    }
  },
  "$defs": {
    "sha256": {
      "type": "string",
      "pattern": "^[a-f0-9]{64}$",
      "not": { "const": "0000000000000000000000000000000000000000000000000000000000000000" }
    },
    "asset": {
      "type": "object",
      "additionalProperties": false,
      "required": ["name", "sha256"],
      "properties": {
        "name": { "type": "string" },
        "sha256": { "$ref": "#/$defs/sha256" }
      }
    },
    "bomSchema": {
      "type": "object",
      "$ref": "#/$defs/asset",
      "properties": {
        "name": { "const": "bom-1.6.schema.json" },
        "sha256": { "const": "3e92dddbc30cf7f6a02b80f0942b1a4cfd4fb1c26f1dfc4310afa9d613cafb93" }
      }
    },
    "spdxSchema": {
      "type": "object",
      "$ref": "#/$defs/asset",
      "properties": {
        "name": { "const": "spdx.schema.json" },
        "sha256": { "const": "baa9d3bd1ed57b6751b0887edead6b5063ff53ff7429cf85d476c6c94af0166e" }
      }
    },
    "jsfSchema": {
      "type": "object",
      "$ref": "#/$defs/asset",
      "properties": {
        "name": { "const": "jsf-0.82.schema.json" },
        "sha256": { "const": "8bae002c25e723db7ee1f26afde680ae1a2b1a8f6b4b4b0fd65dc3becb090aae" }
      }
    }
  }
}
