{
  "schemaVersion": 1,
  "specVersion": "1.6",
  "officialSchemaBaseUrl": "https://raw.githubusercontent.com/CycloneDX/specification/1.6/schema",
  "assets": [
    {
      "name": "bom-1.6.schema.json",
      "sha256": "3e92dddbc30cf7f6a02b80f0942b1a4cfd4fb1c26f1dfc4310afa9d613cafb93"
    },
    {
      "name": "spdx.schema.json",
      "sha256": "baa9d3bd1ed57b6751b0887edead6b5063ff53ff7429cf85d476c6c94af0166e"
    },
    {
      "name": "jsf-0.82.schema.json",
      "sha256": "8bae002c25e723db7ee1f26afde680ae1a2b1a8f6b4b4b0fd65dc3becb090aae"
    }
  ]
}
